<?xml version="1.0" encoding="utf-8"?>

<company 
    xmlns:xsi="http://www.w3.org/2001/XMLSchema-instance"
    xsi:noNamespaceSchemaLocation="company.xsd">
    
    <!-- did is required, a nonempty string unique for all divisions 
    (can be used as a key for divisions) -->
    <division did="production_zlin">
        <!-- name is optional and contains a string -->
        <name>Production factory Zlín</name>
        <!-- head is optional and contains always a person if present -->
        <head>
            <!-- pid is required, unique (positive) integer 
            (can be used as a key for persons);
            the name, surname, salary elts. can be ordered in any order -->
            <person pid="1"> 	
                <!-- name is required, non-empty string -->	 
                <name>Pavel</name>	 
                <!-- surname is required, non-empty string -->
                <surname>Novák</surname> 
                <!-- salary is required, positive number 
	             with 2 decimal places precision, e.g. 10000.50 -->
                <salary>20000.00</salary> 
                <!-- note optional element, repeatable, contains any string -->  
                <note>Poznámka</note>   
            </person>            
        </head>
        <products><!-- optional element, products of the division. Must contain one or more 
                    elements product-->
            <product category="ICBM"> <!-- Division Commodity 
                                      category is required, contains non-empty string without 
                                      whitespace(s)-->
                <name>Šipečka</name> <!-- name of the comodity, alfa numeric string, 
                                          must begin with a letter, it may contain whitespace(s) -->
                <costs>-10000.00</costs> <!-- production costs of the commodity, mansdatory element,
                                             negative number with 2 decimal places precision -->
                <price>110000.00</price> <!-- price of the commodity, mandatory element,
                                             possitive number with 2 decimal places precision -->
            </product>
            <product category="ICBMInstallation"> <!-- Divisioin service -->
                <description>Installation of Šipečka</description>
                                            <!-- Description of a service - mandatory element
                                                contains only letters and whitespace(s)-->
                <price>10000.00</price>     <!-- Price of the service, either 
                                                 price or costs must be included, for 
                                                 content see commodity-->
            </product>
        </products>
    </division>
    <division did="development_brno">
        <head>
            <person pid="2">
                <name>Jan</name>
                <surname>Novák</surname>
                <salary>200000.00</salary>
            </person>
        </head>
        <products>
            <product category="missile_development">
                <description>Development of new missiles</description>
                <costs>-100000.00</costs>
            </product>
        </products>
    </division>
</company>
